{
  "schema_version": "0.1.0",
  "artifact_identity": {
    "id": "A3-CUBE-MANIFEST",
    "display_name": "A3 Stacked Cube Visual System",
    "subtitle": "Strangler-Fig Authority, Evidence, and Recovery Model",
    "version": "0.1.0",
    "family": "Shared Surfaces and Topology / Recovery Routing and Revision",
    "placement": "A3 Appendix / Visual Production Extension",
    "primary_cognitive_move": "show which bounded capability may change authority, under what evidence, while retained and unknown work stays visible",
    "visual_preset": "flat_cobalt_evidence_blueprint_bringhurst_v1.0",
    "source_band": [
      "a3_source_assertion",
      "repository_prototype_grammar",
      "coordinator_adaptation"
    ]
  },
  "source_revision": {
    "source_key": "SRC-A3",
    "a3_page_id": "SRC-A3",
    "a3_page_version": "0.1.0",
    "a3_page_url": "urn:source-key:SRC-A3",
    "repository": "urn:source-key:prototype-exemplars",
    "repository_commit": "e029455bb1ec0d41616f08e52123363cd0876c92",
    "repository_path": "core-architectures-chimeric-prototype-current-pack-v0.1/",
    "verified_on": "2026-07-24"
  },
  "semantic_contract": {
    "cube_means": "a bounded software capability or service dependency; never a team, screen, or human activity merely because it appears in a workflow",
    "position_means": "current execution or decision authority only; position does not encode value, maturity, effort, safety, or priority",
    "migration_means": "a reversible routing and authority change through an explicit seam, validation gate, and rollback route; it is not a copy animation",
    "coupling_rule": "visible gaps imply verified separability; coupled or unknown items remain banded, linked, or retained",
    "human_work_rule": "curator activities remain a human-workflow ribbon unless a bounded software capability has been separately evidenced",
    "unknown_rule": "UNKNOWN is a durable state that stays visible; it is never rendered as an empty or negative state",
    "historical_anchor": "the operational and assignment layer is the first safe, high-value candidate; scientific and regulatory business logic remains legacy unless evidence clears the gate",
    "color_rule": "color is paired with text, shape, hatch, and line style; color never carries authority state alone"
  },
  "storyboard_frames": [
    {
      "id": "F0",
      "sequence": 0,
      "label": "Current authority",
      "short_label": "Coupled legacy",
      "annotation": "Most capabilities remain under legacy or human authority. Coupling and unknowns are explicit.",
      "cognitive_move": "locate current authority and uncertainty"
    },
    {
      "id": "F1",
      "sequence": 1,
      "label": "Seam identified",
      "short_label": "No move yet",
      "annotation": "The operational and assignment seam is bounded. Dependencies, evidence, and rollback are named before routing changes.",
      "cognitive_move": "distinguish a candidate seam from a completed migration"
    },
    {
      "id": "F2",
      "sequence": 2,
      "label": "Shadow / dual-run",
      "short_label": "Selective routing",
      "annotation": "The candidate mirrors or receives bounded traffic while legacy remains authoritative and rollback stays available.",
      "cognitive_move": "show coexistence, evidence collection, and reversibility"
    },
    {
      "id": "F3",
      "sequence": 3,
      "label": "Validated authority",
      "short_label": "Cut over or retain",
      "annotation": "Authority transfers only for the validated capability. Risky, coupled, human, and unknown work remains deliberately visible.",
      "cognitive_move": "show evidence-authorized transfer without implying wholesale retirement"
    }
  ],
  "authority_states": [
    {
      "id": "legacy",
      "label": "Legacy authority",
      "visual": "solid block"
    },
    {
      "id": "seam",
      "label": "Seam identified",
      "visual": "outlined block"
    },
    {
      "id": "shadow",
      "label": "Shadow / dual-run",
      "visual": "hatched split block"
    },
    {
      "id": "new",
      "label": "New authority",
      "visual": "solid alternate block"
    },
    {
      "id": "retained_legacy",
      "label": "Retained legacy",
      "visual": "anchored block"
    },
    {
      "id": "human",
      "label": "Human workflow authority",
      "visual": "workflow ribbon"
    },
    {
      "id": "unknown",
      "label": "UNKNOWN / unbounded",
      "visual": "dashed block"
    }
  ],
  "gates": [
    {
      "id": "GATE-OP-ASSIGN",
      "label": "Operational / assignment authority gate",
      "status": "historically_cleared_for_first_candidate",
      "criteria": [
        "bounded capability and stable semantic identity",
        "known dependencies and system of record",
        "observable parity scenarios",
        "rollback route exercised",
        "audit and permission behavior preserved",
        "human review of residual risk"
      ],
      "protected_behavior_ids": [
        "permissions-remain-least-privilege",
        "case-assignment-remains-auditable",
        "legacy-fallback-remains-available"
      ],
      "review_trigger": "reopen when authority, permission semantics, case routing, or audit expectations change"
    }
  ],
  "capability_cubes": [
    {
      "id": "CAP-OP-ASSIGN",
      "label": "Profiles, permissions & case assignment",
      "short_label": "Operational / assignment",
      "kind": "software_capability",
      "family": "operational_bridge",
      "canonical_order": 1,
      "system_of_record": "legacy viewer before validated cutover",
      "coupling": "bounded_candidate",
      "evidence_status": "historical_source_assertion",
      "migration_state": "first_candidate",
      "gate_id": "GATE-OP-ASSIGN",
      "rollback_route": "return routing and authority to the legacy operational layer",
      "regulatory_risk": "bounded but permission and audit semantics remain material",
      "source_refs": [
        "A3: Which cubes moved"
      ],
      "frame_states": {
        "F0": "legacy",
        "F1": "seam",
        "F2": "shadow",
        "F3": "new"
      }
    },
    {
      "id": "CAP-SEARCH",
      "label": "Standard and advanced search",
      "short_label": "Search",
      "kind": "software_capability",
      "family": "viewer_surface",
      "canonical_order": 2,
      "system_of_record": "legacy viewer",
      "coupling": "potentially_bounded_not_demonstrated_here",
      "evidence_status": "candidate_only",
      "migration_state": "potential_future_seam",
      "gate_id": null,
      "rollback_route": "retain legacy search",
      "regulatory_risk": "unknown until result parity and access behavior are validated",
      "source_refs": [
        "A3: Storyboard 1",
        "A3: accessible Strangler Fig description"
      ],
      "frame_states": {
        "F0": "legacy",
        "F1": "legacy",
        "F2": "legacy",
        "F3": "legacy"
      }
    },
    {
      "id": "CAP-SPECIMEN",
      "label": "Specimen details and overview",
      "short_label": "Specimen overview",
      "kind": "software_capability",
      "family": "viewer_surface",
      "canonical_order": 3,
      "system_of_record": "legacy viewer",
      "coupling": "unknown",
      "evidence_status": "listed_not_bounded",
      "migration_state": "retained_pending_evidence",
      "gate_id": null,
      "rollback_route": "remain legacy",
      "regulatory_risk": "scientific and workflow context may be material",
      "source_refs": [
        "A3: Storyboard 1"
      ],
      "frame_states": {
        "F0": "legacy",
        "F1": "retained_legacy",
        "F2": "retained_legacy",
        "F3": "retained_legacy"
      }
    },
    {
      "id": "CAP-SOP-NOTES",
      "label": "SOPs, notes, and comments",
      "short_label": "SOPs / notes",
      "kind": "software_capability",
      "family": "viewer_surface",
      "canonical_order": 4,
      "system_of_record": "legacy viewer",
      "coupling": "unknown",
      "evidence_status": "listed_not_bounded",
      "migration_state": "retained_pending_evidence",
      "gate_id": null,
      "rollback_route": "remain legacy",
      "regulatory_risk": "procedural and audit context may be material",
      "source_refs": [
        "A3: Storyboard 1"
      ],
      "frame_states": {
        "F0": "legacy",
        "F1": "retained_legacy",
        "F2": "retained_legacy",
        "F3": "retained_legacy"
      }
    },
    {
      "id": "CAP-VARIANT",
      "label": "Variant detail views and status rules",
      "short_label": "Variant details",
      "kind": "software_capability",
      "family": "scientific_business_logic",
      "canonical_order": 5,
      "system_of_record": "legacy viewer",
      "coupling": "deeply_coupled",
      "evidence_status": "explicit_risk",
      "migration_state": "retained_legacy",
      "gate_id": null,
      "rollback_route": "remain legacy",
      "regulatory_risk": "high; diagnostic and under-documented rules",
      "source_refs": [
        "A3: What the Strangler Fig is",
        "A3: Which cubes moved"
      ],
      "frame_states": {
        "F0": "legacy",
        "F1": "retained_legacy",
        "F2": "retained_legacy",
        "F3": "retained_legacy"
      }
    },
    {
      "id": "CAP-QC",
      "label": "Quality control",
      "short_label": "Quality control",
      "kind": "software_capability",
      "family": "scientific_business_logic",
      "canonical_order": 6,
      "system_of_record": "legacy viewer",
      "coupling": "unknown_or_coupled",
      "evidence_status": "listed_not_bounded",
      "migration_state": "retained_legacy",
      "gate_id": null,
      "rollback_route": "remain legacy",
      "regulatory_risk": "high until quality behavior is specified and validated",
      "source_refs": [
        "A3: Storyboard 1"
      ],
      "frame_states": {
        "F0": "legacy",
        "F1": "retained_legacy",
        "F2": "retained_legacy",